{
  "schema_version": 1,
  "host_id": "lab-local-client",
  "software_id": "ops-core",
  "platform": {"os": "macos", "family": "darwin", "arch": "arm64"},
  "install_kind": "package",
  "installed_version": "1.2.3",
  "source": {"kind": "file", "origin": "fixtures/local-fact.json", "version": null, "digest": "aaaaaaaaaaaaaaaaaaaaaaaaaaaaaaaaaaaaaaaaaaaaaaaaaaaaaaaaaaaaaaaa"},
  "observed_at": "2026-09-10T00:00:00Z",
  "evidence_summary": "client-reported version from a local read"
}
